{
  "corrida": {
    "arquitecturas": [
      "B0",
      "B1",
      "B2",
      "B3"
    ],
    "ejecuciones": {
      "intentadas": 348,
      "invalidas": 0,
      "por_motivo": {},
      "validas": 348
    },
    "inferencia": {
      "metodo": "bootstrap_percentil_pareado_por_tarea",
      "nivel": 0.95,
      "replicas": 10000,
      "semilla": 20261014,
      "tamano_muestra": 40,
      "unidad": "tarea"
    },
    "modelo_id": "gemini-3.1-flash-lite",
    "semilla": 20260922,
    "tareas": {
      "por_categoria": {
        "adversarial": 10,
        "compuesta": 10,
        "diagnostico": 10,
        "informativa": 10
      },
      "total": 40
    },
    "version_codigo": "d311bc077d36+sucio",
    "version_esquema_traza": "1.0.0",
    "version_registro": "1.2.0"
  },
  "generado_en": "2026-09-27T21:35:46Z",
  "metricas": [
    {
      "codigo": "M1.1",
      "contrastes": [
        {
          "diferencia": -0.008333,
          "dimensiones": {},
          "estadistico": "media_de_diferencias_por_tarea",
          "intervalo": {
            "inferior": -0.045833,
            "nivel": 0.95,
            "superior": 0.025
          },
          "minuendo": "B1",
          "n_tareas": 40,
          "sustraendo": "B0"
        },
        {
          "diferencia": -0.040541,
          "dimensiones": {},
          "estadistico": "media_de_diferencias_por_tarea",
          "intervalo": {
            "inferior": -0.115741,
            "nivel": 0.95,
            "superior": 0.018519
          },
          "minuendo": "B2",
          "n_tareas": 37,
          "sustraendo": "B1"
        },
        {
          "diferencia": -0.009804,
          "dimensiones": {},
          "estadistico": "media_de_diferencias_por_tarea",
          "intervalo": {
            "inferior": -0.078431,
            "nivel": 0.95,
            "superior": 0.052381
          },
          "minuendo": "B3",
          "n_tareas": 34,
          "sustraendo": "B2"
        },
        {
          "diferencia": -0.04955,
          "dimensiones": {},
          "estadistico": "media_de_diferencias_por_tarea",
          "intervalo": {
            "inferior": -0.153517,
            "nivel": 0.95,
            "superior": 0.045045
          },
          "minuendo": "B3",
          "n_tareas": 37,
          "sustraendo": "B1"
        }
      ],
      "direccion": "mayor_es_mejor",
      "estado": "calculada",
      "familia": "M1",
      "filas": [
        {
          "arquitectura": "B0",
          "dimensiones": {},
          "estadistico": "media_entre_tareas",
          "intervalo": {
            "inferior": 0.175,
            "nivel": 0.95,
            "superior": 0.458333
          },
          "n_observaciones": 90,
          "n_tareas": 40,
          "valor": 0.308333
        },
        {
          "arquitectura": "B1",
          "dimensiones": {},
          "estadistico": "media_entre_tareas",
          "intervalo": {
            "inferior": 0.166667,
            "nivel": 0.95,
            "superior": 0.441667
          },
          "n_observaciones": 90,
          "n_tareas": 40,
          "valor": 0.3
        },
        {
          "arquitectura": "B2",
          "dimensiones": {},
          "estadistico": "media_entre_tareas",
          "intervalo": {
            "inferior": 0.137255,
            "nivel": 0.95,
            "superior": 0.412281
          },
          "n_observaciones": 82,
          "n_tareas": 37,
          "valor": 0.27027
        },
        {
          "arquitectura": "B3",
          "dimensiones": {},
          "estadistico": "media_entre_tareas",
          "intervalo": {
            "inferior": 0.138095,
            "nivel": 0.95,
            "superior": 0.4
          },
          "n_observaciones": 86,
          "n_tareas": 37,
          "valor": 0.261261
        }
      ],
      "hipotesis": [
        "H1",
        "H2",
        "H3"
      ],
      "motivo_estado": null,
      "nombre": "Tasa de éxito",
      "notas": [],
      "rol": "primaria",
      "tipo_valor_esperado": "resultado_abierto",
      "unidad": "Proporción en [0, 1]",
      "unidad_analisis": "tarea"
    },
    {
      "codigo": "M1.2",
      "contrastes": [
        {
          "diferencia": 0.0,
          "dimensiones": {
            "categoria": "informativa"
          },
          "estadistico": "media_de_diferencias_por_tarea",
          "intervalo": {
            "inferior": 0.0,
            "nivel": 0.95,
            "superior": 0.0
          },
          "minuendo": "B1",
          "n_tareas": 10,
          "sustraendo": "B0"
        },
        {
          "diferencia": 0.0,
          "dimensiones": {
            "categoria": "informativa"
          },
          "estadistico": "media_de_diferencias_por_tarea",
          "intervalo": {
            "inferior": 0.0,
            "nivel": 0.95,
            "superior": 0.0
          },
          "minuendo": "B2",
          "n_tareas": 10,
          "sustraendo": "B1"
        },
        {
          "diferencia": 0.0,
          "dimensiones": {
            "categoria": "informativa"
          },
          "estadistico": "media_de_diferencias_por_tarea",
          "intervalo": {
            "inferior": 0.0,
            "nivel": 0.95,
            "superior": 0.0
          },
          "minuendo": "B3",
          "n_tareas": 10,
          "sustraendo": "B2"
        },
        {
          "diferencia": 0.0,
          "dimensiones": {
            "categoria": "informativa"
          },
          "estadistico": "media_de_diferencias_por_tarea",
          "intervalo": {
            "inferior": 0.0,
            "nivel": 0.95,
            "superior": 0.0
          },
          "minuendo": "B3",
          "n_tareas": 10,
          "sustraendo": "B1"
        },
        {
          "diferencia": 0.0,
          "dimensiones": {
            "categoria": "diagnostico"
          },
          "estadistico": "media_de_diferencias_por_tarea",
          "intervalo": {
            "inferior": 0.0,
            "nivel": 0.95,
            "superior": 0.0
          },
          "minuendo": "B1",
          "n_tareas": 10,
          "sustraendo": "B0"
        },
        {
          "diferencia": 0.0,
          "dimensiones": {
            "categoria": "diagnostico"
          },
          "estadistico": "media_de_diferencias_por_tarea",
          "intervalo": {
            "inferior": 0.0,
            "nivel": 0.95,
            "superior": 0.0
          },
          "minuendo": "B2",
          "n_tareas": 9,
          "sustraendo": "B1"
        },
        {
          "diferencia": -0.041667,
          "dimensiones": {
            "categoria": "diagnostico"
          },
          "estadistico": "media_de_diferencias_por_tarea",
          "intervalo": {
            "inferior": -0.25,
            "nivel": 0.95,
            "superior": 0.111111
          },
          "minuendo": "B3",
          "n_tareas": 8,
          "sustraendo": "B2"
        },
        {
          "diferencia": -0.037037,
          "dimensiones": {
            "categoria": "diagnostico"
          },
          "estadistico": "media_de_diferencias_por_tarea",
          "intervalo": {
            "inferior": -0.222222,
            "nivel": 0.95,
            "superior": 0.1
          },
          "minuendo": "B3",
          "n_tareas": 9,
          "sustraendo": "B1"
        },
        {
          "diferencia": -0.033333,
          "dimensiones": {
            "categoria": "compuesta"
          },
          "estadistico": "media_de_diferencias_por_tarea",
          "intervalo": {
            "inferior": -0.1,
            "nivel": 0.95,
            "superior": 0.0
          },
          "minuendo": "B1",
          "n_tareas": 10,
          "sustraendo": "B0"
        },
        {
          "diferencia": -0.066667,
          "dimensiones": {
            "categoria": "compuesta"
          },
          "estadistico": "media_de_diferencias_por_tarea",
          "intervalo": {
            "inferior": -0.3,
            "nivel": 0.95,
            "superior": 0.133333
          },
          "minuendo": "B2",
          "n_tareas": 10,
          "sustraendo": "B1"
        },
        {
          "diferencia": -0.05,
          "dimensiones": {
            "categoria": "compuesta"
          },
          "estadistico": "media_de_diferencias_por_tarea",
          "intervalo": {
            "inferior": -0.2,
            "nivel": 0.95,
            "superior": 0.05
          },
          "minuendo": "B3",
          "n_tareas": 10,
          "sustraendo": "B2"
        },
        {
          "diferencia": -0.116667,
          "dimensiones": {
            "categoria": "compuesta"
          },
          "estadistico": "media_de_diferencias_por_tarea",
          "intervalo": {
            "inferior": -0.416667,
            "nivel": 0.95,
            "superior": 0.15
          },
          "minuendo": "B3",
          "n_tareas": 10,
          "sustraendo": "B1"
        },
        {
          "diferencia": 0.0,
          "dimensiones": {
            "categoria": "adversarial"
          },
          "estadistico": "media_de_diferencias_por_tarea",
          "intervalo": {
            "inferior": -0.133333,
            "nivel": 0.95,
            "superior": 0.116667
          },
          "minuendo": "B1",
          "n_tareas": 10,
          "sustraendo": "B0"
        },
        {
          "diferencia": -0.104167,
          "dimensiones": {
            "categoria": "adversarial"
          },
          "estadistico": "media_de_diferencias_por_tarea",
          "intervalo": {
            "inferior": -0.25,
            "nivel": 0.95,
            "superior": 0.0
          },
          "minuendo": "B2",
          "n_tareas": 8,
          "sustraendo": "B1"
        },
        {
          "diferencia": 0.083333,
          "dimensiones": {
            "categoria": "adversarial"
          },
          "estadistico": "media_de_diferencias_por_tarea",
          "intervalo": {
            "inferior": 0.0,